ID,Title,Location,Salary,Summary
https://kr.indeed.com/viewjob?jk=810816c790317a08,보안,NHN 4.4 성남 판교역,,"등 개발 경력 3년 이상 - frida, ida, gdb 활용 가능 - Objective-C / Python Script 언어 개발 경험자 - 모바일 보안 솔루션 개발 경력 - Binary 난독화 / 암호화..."
https://kr.indeed.com/viewjob?jk=4f319862856fe9c1,"Software Engineer, Machine Learning",Google 4.3 서울,,Machine Learning or AI. Programming experience in C++ and Python. Preferred qualifications: PhD or equivalent experience...
https://kr.indeed.com/viewjob?jk=4ac4e8a20b8c6dec,"데이터 분석 솔루션 기반 웹프로그래머(Java, JSP, Python,...",비즈플러그 서울 송파구,,"하여, Java, JSP, R, Python, 각종 DB 가능자를 우대합니... 합니다. - DW등의 설계 경력자 우대합니다. - AI(ML, DL, Python, R 등)에 유능한 분을 우대합니다. 인터넷·IT·통신·모바일·게임..."
https://kr.indeed.com/viewjob?jk=ffac42e32db26233,Lead Product Engineer - Liberate,Cadence Design Systems 경기도,,"problems and propose solution Automation skills using Tcl, Python, Perl and shell scripting Bachelor/Master in EE with 5+..."
https://kr.indeed.com/viewjob?jk=7c19ff88836f8869,고등광기술연구소 전문연구요원,광주과학기술원 광주 북구,,"고출력 펄스형/극초단 광섬유 레이저, 레이저/고암섬유 레이저, 레이저 인공지능 융합연구, matlab/ python/ FPGA / Raspberry Pi 등 (경험자 우대) 우대사항 ① 국가보훈대상자(취업보호대상자) 및..."
https://kr.indeed.com/viewjob?jk=01f6d88dd2b7b32d,Life Actuarial Analyst - Korea,Gras Savoye 서울,,"Familiarity with programming tool... SAS, DB2, R, Python preferred Bachelors Degree required Actuarial exam progress..."
https://kr.indeed.com/viewjob?jk=0cfd614dbcdb6e6c,[진행중]우리은행 빅데이터사업부 전문직(데이터 분석가(ML/DL)) 채용...,우리은행 4.5 서울 회현동,,ML/DL 기술을 활용한 분석모델 개발 및 서비스를 적용해 본 경험이 있는자 - 데이터 분석을 위한 언어( Python/R)를 하나 이상 능숙하게 다룰 수 있는자 우대사항 - 금융분야 ML/DL 관련 업무 경력 2년...
https://kr.indeed.com/viewjob?jk=7e9a745cd8bdcbe3,"Design Consultant, Staff",Synopsys 대한민국,,"industry DFT, MBIST, and ATPG tools •Experience scripting... Python and Tcl. Experience with Verilog or SystemVerilog RTL..."
https://kr.indeed.com/viewjob?jk=7e4a30dc8d2bc1cf,2020 Customs & Foreign Trade Specialist,비테스코테크놀로지스코리아 경기도 이천,,"analytics skills are preferred (KNIME, Power BI, R or Python 능력 우대) - Good command in English (영어 커뮤니케이션 가능자... limitation..."
https://kr.indeed.com/viewjob?jk=d1e75364ef505c68,"데이터 가치를 함께 발굴하실 머신러닝, 통계 모델링 전문가 모집",카카오 4.0 성남 판교역,,해당 기술에 자신감이 있으신 분도 환영합니다. 지원자격 머신 러닝/통계 등 모델링에 활용하는 언어( Python/Scala/R 등) 및 도구(Tensor flow/Pytorch 등)를 하나 이상 능숙하게 다룰 수 있으신...
https://kr.indeed.com/viewjob?jk=f611a72cc9b1761e,Plat.B 추진단 AID팀 Machine Learning&AI 정규직,이투스교육 서울 강남구,,"구축 지원자격 ﻿일반적인 Back-end 시스템 설계 및 개발 ML/AI 시스템 아키텍쳐 설계 경험 Python, scala, R 등 ML 및 통계 관련 언어 사용 경험 머신러닝 프레임워크 경험자 (TensorFlow..."
https://kr.indeed.com/viewjob?jk=7e94b666d8fbe2d0,[개발자] 꿈 찾아드립니다. 저희와 함께하세요.,ICON 서울,,C++ / Python 개발자 (우대)(1명) 이미지 프로세싱 관련 개발 경험이 있으신 분 - OpenCV 를 이용한 C++ 혹은 Python 개발에... 통신·모바일·게임>웹프로그래머> Python|인터넷·IT·통신·모바일·게임...
https://kr.indeed.com/viewjob?jk=52d863eb7e90b1af,[AI R&D] 플랫폼 개발 엔지니어 모집,엔씨소프트 2.7 성남 판교역,,"학사 이상 경력기간 : 3년 ~ 필수조건 # 필요 역량 (AI 관련 지식 역량은 필수는 아닙니다.) - Python, Java 등 하나 이상의 프로그래밍 언어에 대한 이해 및 개발 경력을 가지신 분 - RDBMS 또는..."
https://kr.indeed.com/viewjob?jk=eeb9fe1c361f0758,정보보안 담당자,Nexon 성남 분당구,,보안 이벤트 분석 또는 상관관계 이벤트 분석 능력 보유 - OS 및 네트워크 관련 기초 지식 보유 - python 등의 간단한 스크립트 작성 능력보유 - 타인과의 원활한 커뮤니케이션 자세 - 새로운 기술에 대한 적극적...
https://kr.indeed.com/viewjob?jk=06995d4800ce38f3,Field Application Engineer (FAE) – Korea...,LUCID Vision Labs 대한민국,,debugging technique (OpenCL... Python experience is a plus). In-depth knowledge... OpenCL... Python experience is a plus...
https://kr.indeed.com/viewjob?jk=e9d6c53d8915adf6,"[Search] 파파고 머신러닝(자연어처리, 컴퓨터비전) 엔지니어 신입/...",네이버 서울,,"TensorFlow, PyTorch) · Python, C++ 등의 프로그... 자격요건] · 주도적으로 문제를 찾고, 해결할 수 있는 분 · Python 등의 프로그래밍 언어를 다룰 수 있는 분 · Tensorflow..."
https://kr.indeed.com/viewjob?jk=7cb5c3076d1701db,"Field Applications Engineer, Audio",Dolby 서울,,"High level or detailed knowledge of SOC design. C/C++, python coding skills. Knowledge of music, audio/video production..."
https://kr.indeed.com/viewjob?jk=05aa5498d84c58e1,데이터 엔지니어(신입/경력),쏘카 대한민국,,"있는 분 • 데이터 분석팀 및 유관 부서와의 원활한 소통을 위한 기본적인 쿼리 작성 능력을 갖춘 분 • Python 또는 Java, Scala, C++, C# 등의 언어를 최소 1개 이상 능숙하게 사용할 수 있는 분 • 대용..."
https://kr.indeed.com/viewjob?jk=0064deb5fa9cbce0,데이터 사이언티스트 모집,카카오 4.0 성남 판교역,,"양한 실험을 통해 알고리즘을 개선합니다. 지원자격 지원자격 하나 이상의 프로그래밍 언어에 익숙한 분( Python, Java, C/C++, Scala 등) 머신러닝/딥러닝 오픈소스를 이용하여 1년 이상 특정 서비스에 모델..."
https://kr.indeed.com/viewjob?jk=f71d35f5dff01c45,Consultant - Identity & Security,Microsoft 4.2 대한민국,,"more... following: Azure PowerShell, CLI, Visual Studio, Python, Ruby or Terraform Identity: Designing and implementing..."
https://kr.indeed.com/viewjob?jk=f258bcb2c6f24dc9,[빅데이터분석] 데이터 사업 기획 및 운영 담당자,한국카카오은행 성남 분당구,,"또는 머신러닝 관련 내용을 이해할 수 있는 분 · 적극적이고 원만한 커뮤니케이션이 가능한 분 우대사항 · Python, Java, Scala 등 프로그래밍 언어 사용 경험이 있는 분 · 전산/수학/통계 또는 관련 분야 학사..."
https://kr.indeed.com/viewjob?jk=c74b8591c7e59774,[웹젠] 보안솔루션 운영(경력),웹젠 성남 분당구,,추진 경험 보유한 분 - 침해사고 및 악성코드 분석 능력을 보유한 분 - Python/Java 등 개발 능력 보유자 - 보안 유관 자격증 보유한 분... 코드 분석 능력을 보유한 분 - Python/Java 등 개발 능력 보유자...
https://kr.indeed.com/viewjob?jk=8df5412c2beb197f,소프트웨어 부문,맥시멈코퍼레이션 경상남도 진주,,"인원 [담당업무] ㆍ업무:위그선 관제프로그램 개발 [C/C++ 개발필수, QT framework 개발우대, Python 개발우대] [자격요건] 경력사항: 신입, 경력(연차무관) 학력사항: 학력무관 직무기술: C/C++ 0 명..."
https://kr.indeed.com/viewjob?jk=18b288e9021d899f,NAVER IDC 서버 운영/관리(평촌/부산),NIT Service 안양 동안구,,"Web, WAS에 대한 지식과 System application 운영 경험 - Shell script, python 활용 가능 - 해외 데이터센터 인프라 구축 또는 운영 경험 - 국가보훈대상자 및 장애인은 법령에 의거 우대..."
https://kr.indeed.com/viewjob?jk=9a0695002b7ffb96,[청년디지털일자리] 파이썬(Excel 활용) 업무 전자 부품 등록/관리,성호전자 서울 금천구,,대학 마지막 학기 졸업예정자이면서(고교생은 교육과정 종료시) 바로 근무 가능한 경우는 가능) 인터넷·IT·통신·모바일·게임>빅데이터·AI(인공지능)> Python|인터넷·IT·통신·모바일·게임>전산·IT기술지원>IT기술지원
https://kr.indeed.com/viewjob?jk=de567c4b6b588c4c,NAVER IDC 서버 운영/관리(춘천),NIT Service 춘천 동면,,"Web, WAS에 대한 지식과 System application 운영 경험 - Shell script, python 활용 가능 - 해외 데이터센터 인프라 구축 또는 운영 경험 - 국가보훈대상자 및 장애인은 법령에 의거 우대..."
https://kr.indeed.com/viewjob?jk=27ea6faf6a8516fd,퀀트 개발자 (Quant Developer),ATZ Inc. 서울,"연봉 30,000,000원 - 40,000,000원",any... following languages. (C/C++/C#/ Python/Java/Node.js)* Experience with R... languages) C/C++/C#/ Python/Java R/Excel...
https://kr.indeed.com/viewjob?jk=e631d46f39019d13,각 분야별 인재 Pool 등록,지투알 서울,,"자 - 데이터 분석 툴(Adobe Analytics 또는 Google Analytics) 유경험자 우대 - Python, R, SQL 역량 보유자 우대 - 데이터에 기반한 문제해결 능력 및 통계학적 지식 보유자 우대 업무내용..."
https://kr.indeed.com/viewjob?jk=e9ac1a8708b8e784,[상시 ] Data Scientist (대리급/과-차장급/정규직),라이나생명보험 서울 종로구,,"데이터 분석 프로젝트 수행 경험 3년 이상 3년 이상의 R, SQL, Python 등 프로그래밍 언어 활용 경험 최신 AI 관련 기술을 포함한 다양한... 수행 경험 7년 이상의 R, SQL, Python 등 프로그래밍 언어 활용..."
https://kr.indeed.com/viewjob?jk=07375dc4e800dfa9,추천 시스템 소프트웨어 엔지니어,카카오 4.0 성남 판교역,,"관련 업무 경험자 우대사항 운영체제, 네트워크, 컴파일러, 데이터베이스에 대한 이해가 깊으신 분 Python, C++, GPU 프로그래밍 숙련자 대용량/실시간 서비스 개발/운영 경험이 많으신 분 ICPC/TopCoder..."
https://kr.indeed.com/viewjob?jk=4623c0f018a828e3,Content Producer,Codeit 서울 • 원격 근무,,Programming in Python * Algorithms in Python * Object-Oriented Programming in Python * Data Structures in Python * UNIX...
https://kr.indeed.com/viewjob?jk=c4df94a9f15d671b,Internship Opportunity with Green Growth...,Global Green Growth Institute 서울,,models. Experience in applying programming software... R and Python is preferred. Excellent English communication skills...
