ID,Title,Location,Salary,Summary
https://kr.indeed.com/viewjob?jk=44b27e9dde454c6a,[고경력자의 경우 시간단축] 홈페이지 개발 및 관리 웹프로그래머,규 대한민국,"월급 2,000,000원",그래머>웹개발|인터넷·IT·통신·모바일·게임>웹프로그래머>HDML|인터넷·IT·통신·모바일·게임>웹프로그래머> Python|인터넷·IT·통신·모바일·게임>웹프로그래머>JAVA|인터넷·IT·통신·모바일·게임>웹프로그래머>HTML...
https://kr.indeed.com/viewjob?jk=74b3d3c938870be2,Data Scientist,Motion2AI 서울,,"thinking to define unstructured problems - Experience with Python (pandas, numpy), R, SQL... VBA to deal... large..."
https://kr.indeed.com/viewjob?jk=24f7f205ae589c18,"[4년제 대졸자 취업연계과정] 융합 SW 바이오 분야, 전공무관, 취업율...",한국폴리텍대학분당융합기술교육원 성남 분당구,,모바일·게임>빅데이터·AI(인공지능)>데이터분석|인터넷·IT·통신·모바일·게임>빅데이터·AI(인공지능)> Python|인터넷·IT·통신·모바일·게임>빅데이터·AI(인공지능)>머신러닝|인터넷·IT·통신·모바일·게임>ERP·시스템...
https://kr.indeed.com/viewjob?jk=73d2d489b37dcf4a,"링크캠퍼스 웹개발, 웹마스터 외 신입/경력 정규직",링크캠퍼스 광주 동구,"연봉 21,870,000원 - 25,000,000원","직무기술: 웹프로그래밍, 앱, 무선인터넷, 웹서비스, JAVASCRIPT, 웹기획, 스마트폰, IOS, PYTHON 기타: 지원대상 : 웹 또는 앱 개발가능(관심)자 우대사항 : 관련전공(자격증보유)자, AI(인공지능)관심자..."
https://kr.indeed.com/viewjob?jk=cd5ca556791f1f79,[브랜디] 경영본부/사업본부/개발직군 신입 및 경력,브랜디 서울 강남구,,"수 있는 분 - SQL, R, Python 등 데이터 관련 언어 사용이... 형상관리에 대한 이해 - (경력) 웹 서비스 개발 경험 - (경력) Python 유경험자 - (경력) AWS, Azure 등 클라우드 환경 프로젝트..."
https://kr.indeed.com/viewjob?jk=71c47ac87bb4087e,기술 인턴 인공지능 응용 연구/개발 인턴,써로마인드로보틱스 서울 관악구,,"6개월) (협의) *모집 절차: 서류 à인터뷰(오프라인) *지원 자격: 프로그래밍 언어 활용 능력: Python, C, C++ 중 1가지 이상 데이터구조, 알고리즘 과목 이수 머신러닝과 딥러닝의 기본 개념 이해 머신러닝..."
https://kr.indeed.com/viewjob?jk=1d2b22a2bcd3256f,[AI/Lab] AI 백엔드 엔지니어 (마케팅 분야),버즈니 서울,,"으로 마케팅 인사이트 도출 – 보유하고 있는 빅 데이터를 활용하여 마케팅 인사이트 도출 이런 분을 찾습니다 Python 프로그래밍에 능숙하신 분 DB, 통계, 컴퓨터 기반 기술에 대한 이해를 가지신 분 이런 분은 더욱 좋습니..."
https://kr.indeed.com/viewjob?jk=70fccff4d30cb6bf,NAVER IDC 서버 운영/관리(가산),NIT Service 서울 가산동,,"Web, WAS에 대한 지식과 System application 운영 경험 - Shell script, python 활용 가능 - 해외 데이터센터 인프라 구축 또는 운영 경험 - 국가보훈대상자 및 장애인은 법령에 의거 우대..."
https://kr.indeed.com/viewjob?jk=01296857655fc85f,(주)신세계아이앤씨 AI/클라우드 부문 상시,신세계아이앤씨 서울 중구,,"험자 -. Programming : Python, Java, Node.js... 구축 프로젝트 PM or AA 경험자 -. Programming : Python, Java, Node.js, Ruby, .NET, Scala ※ 상기..."
https://kr.indeed.com/viewjob?jk=2695294aea6dc3b6,MongoDB Engineer 모집,카카오 4.0 성남 판교역,,수 있는 분 Linux/Network에 대한 기초 지식이 있는 분 우대 사항 C/C++ 또는 Python 언어를 이용한 프로그램 개발(프로젝트) 경험이 있는 분 MongoDB 트러블 슈팅 경험이 있는 분 MongoDB...
https://kr.indeed.com/viewjob?jk=649ccf047c868778,"금융 데이터 분석 엔진, 로보어드바이저 개발자",에스비씨엔 서울 영등포구,,"시스템, 머신러닝, 자연어처리. 패턴분석 - 다음 언어에서 최소 한 가지 이상 능숙자: Java, C++, Python, JavaScript 우대사항 - 석사이상 컴퓨터공학 (Computer Science) 분야 또는..."
https://kr.indeed.com/viewjob?jk=b1376913a965e740,Machine Learning Software Engineer - Emb...,Qualcomm Korea YH 서울,,related field. - Proficiency in C/C++ programming. - Python programming. - Basic knowledge of machine learning and deep...
https://kr.indeed.com/viewjob?jk=da707a546a13ee22,Data Science 컨설턴트 - 글로벌 컨설팅펌,에스에프인촌 서울 서초구,,"분석 등을 통한 Insight 도출 자격요건 통계학과/산업공학과/컴퓨터공학과 등 유관 학과 졸업/석박사 우대 Python 등 관련 코딩 경력 빅데이터, 통계, Machine Learning, 알고리즘 등 Artificial..."
https://kr.indeed.com/viewjob?jk=8af26b37623864c4,8퍼센트 개발자 (신입/경력),8퍼센트 서울 종로구,,개발 금융 데이터 분석과 분석 플랫폼 운영 자격요건 컴퓨터 전공자 또는 웹 개발 경력 1년 이상 우대사항 Python 코드를 무리 없이 읽으실 수 있는 분 Linux/Mac 사용 가능한 분 새로운 기술에 대한 호기심을 가지신...
https://kr.indeed.com/viewjob?jk=e0e37aaebc73dde3,지표구축,아프리카TV 경기도 성남,,"대시보드 플랫폼의 활용이 가능하신분 - 새로운 서비스 출시후 모니터링이나 트랜드 확인이 가능하도록 설계나 지원이 가능하신분 - SQL,Excel,R, Python 등을 이용하여 데이터 추출 또는 분석이 가능하신 분"
https://kr.indeed.com/viewjob?jk=752a4b5d63eac97c,Back-end Engineer (Python),Soomgo 서울 강남구,,래픽 처리를 위한 AWS 인프라 구축 • 5년 이상의 웹/앱 서비스 백엔드 시스템 개발 경험이 있는 분 • Python 언어를 활용한 개발 경험이 있는 분 • 성능 최적화에 대해 지속적으로 고민하고 노력하시는 분 • AWS...
https://kr.indeed.com/viewjob?jk=5c88acd09f153fc3,[취업연계 무료교육] 차세대 스마트공장 현장 엔지니어 전문가 양성과정 수...,한국산업기술협회 서울 금천구,,통신·모바일·게임>빅데이터·AI(인공지능)>머신러닝|인터넷·IT·통신·모바일·게임>빅데이터·AI(인공지능)> Python|인터넷·IT·통신·모바일·게임>ERP·시스템분석·설계>빅데이터|인터넷·IT·통신·모바일·게임>ERP·시스...
https://kr.indeed.com/viewjob?jk=bc4c4f6e75fc8a77,(주)쓰리에치솔루션 부문별 신입/경력 직원,쓰리에치솔루션 청주 흥덕구,,요건] 인공지능 관련 과목을 이수하여 논문을 이해하고 구현이 가능한자 Python 프로그래밍 가능자 Tensorflow / Pytorch 이용한 프로... hyperledger 경험자 Python이나 Node.js를 이용한 WEB...
https://kr.indeed.com/viewjob?jk=78e99625e5de3c95,전문연구요원 (병역특례) 수시 (AI / HW 분야),딥엑스 성남 분당구,"연봉 40,000,000원 - 100,000,000원","모델의 RTL IP 설계 및 IP 검증 가능자 - Language: Python/Perl, C/C++ [우대 조건] - ARM based SoC 설계... Linux, shell, tcl, python, perl 사용 원활..."
https://kr.indeed.com/viewjob?jk=9040dba1c8db2a5d,퀀트운용팀 (사원-대리급),신한비엔피파리바자산운용 대한민국,,지식 보유자 - 투자자산운용사 자격증 소지자 우대 - CFA/CAIA/CPA 자격증 소지자 우대 - VBA/ Python 활용한 업무 가능자 우대 - 관련 전공 및 석박사 학위/금융 관련 자격증 보유자 우대 3. 전형방법...
https://kr.indeed.com/viewjob?jk=9a818d9d91db847d,Data Analytics SA,Amazon Web Services Korea LLC 서울,,"some relevant languages, tools and frameworks (e.g python, Java, R, scala, spark, Kafka, Hadoop ecosystem, presto, Hive..."
https://kr.indeed.com/viewjob?jk=a4ade495ab488c6f,사물인터넷(IoT) 개발자 (하드웨어 및 소프트웨어),큐빅스 경기도 파주,,통신·모바일·게임>시스템프로그래머>임베디드(Embedded)|인터넷·IT·통신·모바일·게임>응용프로그래머> Python|인터넷·IT·통신·모바일·게임>응용프로그래머>JAVA|인터넷·IT·통신·모바일·게임>응용프로그래머>자바스크...
https://kr.indeed.com/viewjob?jk=e91a6a5eb66c641f,21년 상반기 현대오트론 경력사원 수시,현대오트론 서울,,통신·모바일·게임>응용프로그래머>Linux|인터넷·IT·통신·모바일·게임>응용프로그래머>C·C++|인터넷·IT·통신·모바일·게임>응용프로그래머> Python|인터넷·IT·통신·모바일·게임>빅데이터·AI(인공지능)>자율주행
https://kr.indeed.com/viewjob?jk=241ae1e7499c461c,Security Engineer (모의해킹/취약점 점검),Toss 서울 강남구,,"그바운트 경험이 있는 분 - 해킹대회 우승 경력이 있는 분 - 다양한 플랫폼 보안 진단 경험이 있는 분 - Python, C, C++, C#, JAVA 중 프로그래밍 언어에 능숙 하신 분 # 현업 인터뷰 - 결제 산업의 미래..."
https://kr.indeed.com/viewjob?jk=bfe0f5ac4f32ec89,추천 통계분석/데이터사이언티스트,카카오 4.0 성남 판교역,,기능 기계학습 모델링 지원자격 개발 경력 3년 이상 숙련된 데이터분석 능력 데이터 사이언스를 위한 언어( Python/R) 를 하나 이상 능숙하게 다룰 수 있으신 분 분석 결과를 설득력있게 전달할 수 있는 분 우대사항...
https://kr.indeed.com/viewjob?jk=b2661d357cf26c8f,플랫폼쉴드 시스템 개발,Nexon 성남 분당구,,"IP, 평판 등의 정보) 지원자격 - 전체 개발 경력 3~5년 - Python, Go 개발경력 우대(팀 내부 주 개발 언어가 Go, Python) - 비동기, 병렬처리 프로그래밍 기술 - OS, DB, H/W, 네트워..."
https://kr.indeed.com/viewjob?jk=eaee1538d8cc832f,메시지발송 플랫폼 개발자,Nexon 성남 분당구,,"개발 가능하면서 python 개발 경험 소유자(또는 Python 개발 가능... NET 또는 python 개발 경력 5년이상 - 자동화를 위한 스크립트(powershell, bash, python 등) 경험 - Windows..."
https://kr.indeed.com/viewjob?jk=46975ee759c13b8a,데이터 분석/처리 플랫폼 개발,NHN 4.4 성남 판교역,,"데이터 수집, 처리 및 지표 분석 경험 - 데이터 기반의 문제해결 역량 및 논리적 사고 - Java, Python, Scala 중 최소 1가지 언어를 이용한 데이터 분석 및 소프트웨어 개발 역량 - 통계분석..."
https://kr.indeed.com/viewjob?jk=cae2de07045cfb2b,"Java, Python 영상툴 개발자",에이아이메이커 서울 마곡동,,원하면 가능) 담당업무 - 영상 라벨링 Tool 개발 - Tool 정확성 개선 자격요건 - Java - Python 우대사항 - 관련 개발 경력 - 툴개발 경력 근무조건 - 월~금 AM9:30 ~ PM18:30 복지...
https://kr.indeed.com/viewjob?jk=96688eea9c1a9e28,Security Engineer (취약점 분석),Toss 서울 강남구,,"# 자격 요건 - 모의해킹 및 취약점 점검 경력이 있는 분 - 소스 코드 정적 취약점 점검에 능숙한 분 - Python, C, C++, JAVA 중 프로그래밍 언어에 능숙한 분 # 우대 사항 - 국내 또는 국외 버그 바운티..."
https://kr.indeed.com/viewjob?jk=11fa90db108dc242,[AI R&D] 데이터 엔지니어 모집,엔씨소프트 2.7 성남 판교역,,"지원자격 학력 : 학사 이상 경력기간 : 3년 ~ 필수조건 - 하나 이상의 프로그래밍 언어에 익숙한 분( Python, Java, Scala 등) - RDBMS 또는 NoSQL 개발 경험을 가지고 계신 분 - 성능을 고려한..."
https://kr.indeed.com/viewjob?jk=8a15326f80e07c08,Customer Operations Engineering Manager,Success Korea 대한민국,,experience in C++ or Java and Python - Network monitoring and application... C++ or Java and Python - Network...
https://kr.indeed.com/viewjob?jk=9a4126f3920d2c99,[IT무료취업교육] 온오프 연계 AI 활용 서비스 개발,멀티캠퍼스 서울 서초구,,통신·모바일·게임>빅데이터·AI(인공지능)>머신러닝|인터넷·IT·통신·모바일·게임>빅데이터·AI(인공지능)> Python|인터넷·IT·통신·모바일·게임>빅데이터·AI(인공지능)>딥러닝|인터넷·IT·통신·모바일·게임>빅데이터...
https://kr.indeed.com/viewjob?jk=4e91309fc89e9534,2020년 하반기 영업/기획/마케팅/개발 부문,아우토크립트 서울 영등포구,,통신·모바일·게임>응용프로그래머> Python|인터넷·IT·통신·모바일·게임... 프로그래머> Python|인터넷·IT·통신·모바일·게임>웹프로그래머>JAVA|인터넷·IT·통신·모바일·게임>빅데이터·AI(인공지능)> Python|인터넷...
https://kr.indeed.com/viewjob?jk=34e05b9e4079e7d6,광학솔루션사업부 경력사원 (렌즈개발/Actuator개발/Digital T...,LG이노텍 4.1 경기도 안산,,"공정 데이터 기반 딥러닝/머신러닝 알고리즘 개발 (5년 이상) - 프로그래밍 가능자 (SQL, SAS, Python, R 등) - AWS 프레임워크 사용 유경험자 [학력] - 학사 이상, 컴퓨터공학, 산업공학 등 공학 전공자..."
https://kr.indeed.com/viewjob?jk=6d27fdce96fe586d,"생명정보학자(연구원, 분석가) 신입/경력 계약직",고려대학교산학협력단 서울 성북구,,"경력 1년 이상 성별 : 무관 모집인원 : 1명 전공 : 생명과학, Bioinformatics 우대사항 : Python, R, Linux 서버 경험자, WGS, WES 분석 경력자 1 명 근무조건 고용형태 : 계약직(기간제..."
https://kr.indeed.com/viewjob?jk=2f45b4d9ff507a82,[베스파] 데이터 분석(Data Analyst),베스파 서울 강남구,,분 - 게임을 일로 접근할 수 있는 마음을 가지신 분 ▣우대사항 - 전공 : 통계학/컴퓨터공학/심리학 - Python 또는 R 활용 역량을 보유하신 분 - 게임 회사에서의 데이터 분석 경험이 있으신 분 - BigQuery...
https://kr.indeed.com/viewjob?jk=7d4bc2a107c6669b,Customer Engineer,Microsoft 4.2 서울,,least 5 years welcome experience in model development using python or R. Experience in migrating from one database to another...
https://kr.indeed.com/viewjob?jk=6876f9db4384c69b,자동차업무팀 자동차상품파트(신입) Associate 채용,AXA손해보험 서울 갈월동,,"기술/능력] - 자동차 상품과 요율에 대한 이해 우대 - 통계분석 Tool 활용 능력 우대 (SAS, R, Python 등) [기타 사항] - 긍정적 마음가짐과 도전정신 - 업무와 관련된 원활한 의사소통 능력 필수..."
https://kr.indeed.com/viewjob?jk=d8a8869ab092f731,데이터 엔지니어 및 사이언티스트,카카오 4.0 성남 판교역,,"등 데이터 엔지니어와 사이언티스트의 업무를 경계 없이 수행하게 됩니다. 지원자격 개발 경력 3년 이상 Python, Scala, Java, C++ 중 하나 이상의 언어에 능통 SQL 또는 HiveQL에 능통 대용량 데이..."
https://kr.indeed.com/viewjob?jk=e15972f6e01cb7dc,IT 개발자(백엔드) 경력직,스포츠데이터에볼루션 경기도 파주,"연봉 24,000,000원 - 26,000,000원","경력자 채용 ( 1명 ) 필수 자격요건 ㆍ학력 : 초대졸이상 ㆍ경력 : 해당 직무 경력 1년 이상 - Python, PHP, C#, Node.js, Java 중 1개 이상 능숙자 - MS-SQL, MySQL, MariaDB..."
https://kr.indeed.com/viewjob?jk=e5448ffc7d6ecf02,FPGA 플랫폼 엔지니어 (딥러닝 하드웨어 프로세서 개발),딥엑스 성남 분당구,"연봉 40,000,000원 - 100,000,000원","사용 경험(Chip Scope/SignalTap) - Language: Python/Perl, C/C++ - Vivado 또는 Synplify 또는... SignalTap) - Language: Python/Perl, C/C++..."
https://kr.indeed.com/viewjob?jk=a2b8aae664300392,신한AI 인공지능(AI) 인력,신한에이아이 서울 영등포구,,"련전공 : 인공지능 / 수학 / 산업공학 / 컴퓨터공학 / 통계 관련 [우대사항] - 프로그래밍 숙련자 ( python 外 C++, Java 등) - 금융데이터 또는 시계열 데이터 기반 인공지능 모델 구축 및 운영경험 - 강화..."
https://kr.indeed.com/viewjob?jk=84fd9f9deb6105b0,"웹개발, Python 외 신입/경력 계약직",쿠바로엠앤씨 서울 강서구,,"주식회사 쿠바로엠앤씨 웹개발, Python 외 신입/경력 계약직 채용 모집... 게임>웹프로그래머>웹개발|인터넷·IT·통신·모바일·게임>웹프로그래머> Python|인터넷·IT·통신·모바일·게임>웹프로그래머>백엔드|인터넷·IT·통신..."
https://kr.indeed.com/viewjob?jk=f0df38dd41b4447f,AML 데이터 분석/모델링 전문가 모집,네이버파이낸셜 성남 정자동,,"합니다. 자격요건 - 대용량 데이터 분석 Skill/Tool 사용이 가능하신 분 (SAS, R, Python 등) - Anomaly Detection 관점에서의 예측 모델링 개발을 경험하신 분 [우대사항] - FDS..."
https://kr.indeed.com/viewjob?jk=85e44b7572a7c332,카카오 분산 기술 플랫폼 개발자 모집,카카오 4.0 성남 판교역,,"및 운영 신규 플랫폼 발굴 및 개발 지원자격 개발 경력 2년 이상 Linux환경에서 C/C++, Go, Python 등 언어 중 하나 이상 가능하신 분 협업 및 커뮤니케이션이 원활한 분 시스템 운영에 책임감이 있으신 분..."
https://kr.indeed.com/viewjob?jk=8525eb04feb95444,[KSTEC] 2021년 경력 사원 (SW개발자),지식시스템 성남 분당구,,"개발 (SPSS, SAS, R, Python, Java 기반) 2. 기업용... 경력 3년 ~ 10년 [기술요구사항] 1. SPSS, SAS, R, Python, Java 등 데이터분석/AI개발 도구 사용 가능자 2. Java..."
https://kr.indeed.com/viewjob?jk=aac8e9355cb855ac,[인재풀] 아티스트,Electronic Arts 서울,,Maya or 3D Max등의 아트웍 툴 사용 경험 Max script 또는 Mel Script의 사용 경험 C# 또는 Python 언어에 대한 이해 및 활용 능력 아트웍 관련 툴 제작 또는 플러그인 제작 경험
https://kr.indeed.com/viewjob?jk=29c6b79d1a7d446d,2021년 신입/경력직,다나와 서울 양천구,,"응시자격 지원하기 데브옵스개발 경력 데브옵스(devops) 환경 구축 및 품질향상 경력 1~7년 Java, Python에 대한 이해보유자 Spring Boot 또는 Express.js 프레임워크 이해 보유자 바로가기 데이터베..."
https://kr.indeed.com/viewjob?jk=d4c52ba1a491a8b9,현대무벡스 경력사원 상시,현대무벡스 서울 종로구,,PM>웹기획|인터넷·IT·통신·모바일·게임>웹프로그래머>JAVA|인터넷·IT·통신·모바일·게임>웹프로그래머> Python|인터넷·IT·통신·모바일·게임>네트워크·서버·보안>정보보안|인터넷·IT·통신·모바일·게임>응용프로그래머>클라우드
https://kr.indeed.com/viewjob?jk=f4c784e2cb1ecbbb,Technical Specialist,Microsoft 4.2 서울,,"Developer experience in C#, Java, Node.js/JavaScript and Python. Data and analytics experience – Machine Learning skills..."
https://kr.indeed.com/viewjob?jk=9d9f5827c98272c9,테크빌더팀 웹어플리케이션 개발자 (백앤드/프론트앤드),Nexon 성남 분당구,,"주요업무 - 유저동향분석 시스템, 개발팀 지원 서비스 운영 및 개발 사용언어 및 라이브러리 - Python + Flask - JavaScript, React, Angular, JQuery - Elastic Search..."
https://kr.indeed.com/viewjob?jk=996aed4fb9a166e0,[정규직] 금융 신규사업(AI예측기반 Data사업) 데이터 분석 전문인력,SK 씨앤씨 4.0 서울,,역량/스킬 - 금융 시장지수/가격 등 데이터에 대한 이해 - 금융/시계열 BigData/AI 분석역량(R/ Python/Tensorflow/pyTorch 등) - 개별예측모델 구축 및 앙상블 분석/최적화 역량 - Agile...
https://kr.indeed.com/viewjob?jk=273ef18c985200fe,Cloud Support Engineer - Linux,Amazon Web Services Korea LLC 서울,,"NoSQL(Redis, Memcached). · Programming/scripting in Python/Java/Shell/Perl/Ruby/PHP/etc. · Experience managing full..."
https://kr.indeed.com/viewjob?jk=ceb8243bc8ae3c35,[데이터 플랫폼]데이터 엔지니어 (전문연구요원 가능),버즈니 서울,,및 유지보수 이런 분을 찾습니다 관련 업무 경력 최소 3년 이상 있으신 분 (전문연구요원의 경우 경력 무관) Python 및 기반 데이터 플랫폼 개발 경험이 있으신 분 Docker(Contatiner) 기반 시스템 환경 구축...
https://kr.indeed.com/viewjob?jk=ad07d6a330fb619a,TOAST Cloud 운영 및 기술지원,NHN 4.4 성남 판교역,,"Linux, Microsoft Solutions 등) - 2년 이상의 개발 경험 (Java, Python 등) - 기술 문서 작성 및 가이드 경험이 풍부한 자 - 대외 고객 기술 지원 경험 - Windows..."
https://kr.indeed.com/viewjob?jk=98c2229e57d4ee1f,전기전자컴퓨터공학부(바이오컴퓨팅연구실) 위촉연구원,광주과학기술원 광주 북구,,"국가보훈대상자(취업보호대상자) 및 장애인은 관련 법령에 의거하여 우대 ② 컴퓨터 프로그램밍 (Matlab, Python, C++등) 가능자 ③ 뇌파 측정 및 분석 2년 이상 경력 ➃ 딥러닝 기술 개발 경험 결격사유..."
https://kr.indeed.com/viewjob?jk=8ee4ab813459185c,AI 분석 개발 경력자,토니서치 성남 분당구,,"니어 - 데이터전처리,분석을통한 알고리즘선정및 fine tuning - python 으로 검증된 학습코드를 자체 빅데이터 분석플랫폼에 이식 [근무부서... 등 빅데이터분석환경 경험 - Python 언어로 프로그래밍 가능..."
https://kr.indeed.com/viewjob?jk=dd4d8e59a4a9265d,Data Specialist (Scientist&&Engineer),아우름플래닛 서울 마포구,,"Tensorflow, Keras, Pytorch, Theano 등)를 하나 이상 사용할 수 있는 분 • R, Python, Scala, SQL 등을 이용한 데이터 분석 및 프로그램 개발 능력이 있는 분 • 데이터 분석 기법..."
https://kr.indeed.com/viewjob?jk=dbe3257e487e5814,[AI Lab] AI 백엔드 엔지니어 (전문연구요원 가능),버즈니 서울,,"플랫폼 및 시스템 구축 이런 분을 찾습니다 주도적으로 문제를 찾고, 해결할 수 있는 능력을 보유하신 분 Python 사용 경험이 있으신 분 다음 항목 중 두 가지 이상에 해당되는 분 AWS 혹은 GCP와 같은 클라우드 플랫폼..."
https://kr.indeed.com/viewjob?jk=776ccceeaf6fe02e,DGIST 동반진단의료기술융합연구실 계약직 연구원 공개 채용 공고,대구경북과학기술원 대구 현풍면,,"경험자 Matlab 또는 Python 활용 능력 우수자 C/C++... 분석 수행 Python을 통한 Data 처리 및 DB 구축 윈도우/리눅스 환경 프로그래밍 가능자(C++, Java, Python 등) 자동..."
https://kr.indeed.com/viewjob?jk=7bf179a290a157b2,경험최적화파트 - 머신러닝 엔지니어,Nexon 성남 분당구,,모델 개발 - 머신러닝을 위한 솔루션 프로토타이핑 - 머신러닝 파이프라인 설계 및 구축 지원자격 - Python에 숙련된 프로그래밍 능력과 머신러닝 라이브러리 활용 경험 - 머신러닝과 강화학습에 관련된 지식 습득 혹은...
https://kr.indeed.com/viewjob?jk=481f953ccaa4bc96,AI 연구/개발 직군 모집,넷마블 서울 구로구,,"ML 관련 분야 경력 6년 이상 - Cloud 서비스 활용 경험 - Python, C/C++, SQL 사용 가능 - Tensorflow 또는 상응하는... 웹 서비스 구축 등 자격요건 - Python 에 능숙하고 C/C++ 혹은..."
https://kr.indeed.com/viewjob?jk=78d1ec77f4a5e0dc,기후 분석&모델링연구실 시간제연구원,광주과학기술원 광주 북구,,"수행 ① 국내외 4년제 대학교 환경공학관련분야 학사 이상 학위소지자로서, ② Fortran, GrADS, python 중 1개 이상의 프로그램 언어 사용 가능자 우대사항 ① 국가보훈대상자(취업보호대상자) 및 장애인은..."
https://kr.indeed.com/viewjob?jk=d748c217f78dbd58,DBA 엔지니어,쏘카 대한민국,,"시계열 데이터베이스(InfluxDB) 구축 및 운영 경험이 있으신 분 • 자동화를 위한 스크립트(Shell, Python, Ansible) 지식을 보유하신 분 • 새로운 기술 도입에 대한 오픈 마인드를 갖고 계신 분 전형절차..."
https://kr.indeed.com/viewjob?jk=30352a55b8205ca8,AML 데이터 분석/모델링 전문가,네이버 서울,,"니다. [자격요건] - 대용량 데이터 분석 Skill/Tool 사용이 가능하신 분 (SAS, R, Python 등) - Anomaly Detection 관점에서의 예측 모델링 개발을 경험하신 분 [우대사항] ﻿ - FDS..."
https://kr.indeed.com/viewjob?jk=20d40ee61adffeca,챗봇 플랫폼 개발자 모집,카카오 4.0 성남 판교역,,"서비스에 대한 두려움이 없으신 분 서버 개발 Java, Scala, Kotlin 등의 JVM 기반 언어 및 Python을 이용해서 실서비스 개발 및 운영해보신 분 데이터 엔지니어 Kafka, Elasticsearch..."
https://kr.indeed.com/viewjob?jk=15edcadd124ad99a,매칭 데이터분석,Nexon 성남 분당구,,"최적화 된 모델을 적용하고 평가합니다. 지원자격 [이런 경험을 가진 파티원을 찾습니다.] - SQL, Python 등의 언어를 통해 데이터를 가공한 경험이 있는 분을 찾습니다. - 문제에 적합한 머신러닝 모델을 선택하고..."
https://kr.indeed.com/viewjob?jk=b78a2f2a8bc3776d,2021년 경력사월 수시(1차),케이티디에스 서울 서초구,,"원버튼을 클릭 하시면 기업 홈페이지로 이동 합니다. 직무/산업 직무별(직종) 웹프로그래머JSP, JAVA, Python, ASP.NET 응용프로그래머전산전공, Windows, Unix, Linux 산업별(업종) 솔루션.ASP..."
https://kr.indeed.com/viewjob?jk=2c4c5856662783e7,Data Analyst,IQVIA 서울,,learning / predictive modeling ) • 통계 프로그램 활용 능력 SAS / R / Python 중 최소 1가지 중급 이상의 활용능력 요구 • Communication Basic English...
