ID,Title,Location,Salary,Summary
https://kr.indeed.com/viewjob?jk=010d38b18b07b6bb,데이터 분야 경력,LG CNS 3.7 서울,,"해가 뛰어난 자 - R, Python, SAS, SQL 등 활용 역량 우대사항(해당 내용 중 1개 이상) - ML/DL 경험 인력 우대 - 관련 분야 석사 이상 학위 소지자 우대 - R, Python등 데이터분석 모델링 경험..."
https://kr.indeed.com/viewjob?jk=4cd34228af5013fd,DGIST 2019년 제1차 계약직원 공개채용 공고,대구경북과학기술원 대구 현풍면,,"우수자(SPSS, R 등 통계패키지) 외국어(영어) 구사 능력 우수자 Programming(MATLAB, Python, C/C++ 등) 가능자 · 근무기간 : 2019.3.11.~2020.3.10. ※ 단, 재계약 평가에..."
https://kr.indeed.com/viewjob?jk=927439a84026234e,[빅데이터플랫폼] 데이터 엔지니어,한국카카오은행 성남 분당구,,"Kafka, Flink 등을 사용한 대용량 데이터 처리에 능숙한 분 · Java, Kotlin, Python 중 하나 이상의 언어에 익숙한 분 · 총 경력이 3년 이상인 분 우대사항 · Hadoop EcoSystem 기반의..."
https://kr.indeed.com/viewjob?jk=da5c549bf1a76ded,데이터 사이언스(데이터 모델링 및 추천 모델링),NHN 4.4 성남 판교역,,"AB테스트, 결과 해석 등) - 리눅스 환경에서 머신 러닝 및 데이터 분석 관련 언어, 라이브러리( Python, R, SQL, tensorflow 등) 능숙한 활용 - 머신러닝, 추천 , 딥러닝 관련 논문을..."
https://kr.indeed.com/viewjob?jk=273ef18c985200fe,Cloud Support Engineer - Linux,Amazon Web Services Korea LLC 서울,,"NoSQL(Redis, Memcached). · Programming/scripting in Python/Java/Shell/Perl/Ruby/PHP/etc. · Experience managing full..."
https://kr.indeed.com/viewjob?jk=a1d687cd59776360,머신러닝 개발,Nexon 성남 분당구,,모델 개발 - 머신러닝을 위한 솔루션 프로토타이핑 - 머신러닝 파이프라인 설계 및 구축 지원자격 - Python에 숙련된 프로그래밍 능력과 머신러닝 라이브러리 활용 경험 - 머신러닝과 강화학습에 관련된 지식 습득 혹은...
https://kr.indeed.com/viewjob?jk=b4c6146c52b4dc2b,(주)테라젠바이오 데이터과제팀 계약직,테라젠바이오 수원 영통구,,"등 한 가지 이상의 Back-end Framework 경험 - Git 등의 협업 툴 사용 우대사항: - Python 사용 경험 - Linux 숙련자 - 컨테이너(Docker, k8s), 클라우드 경험 0 명 근무조건 고용형태..."
https://kr.indeed.com/viewjob?jk=4ec305f59ce64060,게임이상탐지 분석/개발,Nexon 성남 분당구,,"기법 적용에 필요한 프로그래밍 능력 ( Python) - SQL 활용 능력... 대시보드 개발 능력 솔루션 개발자 - 한 가지 이상의 개발 언어( Python, Java, Scala)에 숙련된 프로그래밍 능력 - Linux..."
https://kr.indeed.com/viewjob?jk=210243e0776dc26f,Data Engineer(신입),PUBG 서울,,"해외 여행에 결격사유가 없고, 한국어 의사소통이 원활하신 분 - 서초 Office 출근이 가능하신 분 - python으로 프로그래밍이 가능하신 분 [우대 사항] - 퍼블릭 클라우드 서비스에서 개발하고 운영 하는 것에 관심..."
https://kr.indeed.com/viewjob?jk=d13fce11058e6cf1,보안 모니터링 시스템 개발 및 운영 담당자 모집,카카오 4.0 성남 판교역,,"이터 분석을 위한 SIEM/ETL 플랫폼 개발/운영 지원자격 기본사항 경력 5년 이상 Java, Python 등의 언어로 개발 가능자 기본적인 웹 개발 및 Back-End 개발 가능자 DBMS 혹은 빅데이터(NoSQL..."
https://kr.indeed.com/viewjob?jk=e7346aa4ba6c1633,금융 AI 기술 연구 개발자 모집,엔씨소프트 2.7 성남 판교역,,"및 연구/문제 해결 능력 - Python 언어에 능숙하신 분 2. 해당직... Recognition, Data/Text Mining 경험 보유 - Python, SQL 활용 우대사항 - AI 관련 전공자 - 금융 도메인에 대한..."
https://kr.indeed.com/viewjob?jk=9ccd0db79695e27e,[단기계약직] 인공지능 기술 개발을 위한 언어 데이터 구축자 모집,엔씨소프트 2.7 성남 판교역,,언어 데이터를 꼼꼼하게 분석하고 정리할 수 있으신 분 - 언어자원 구축 경험이 있으신 분. - 엑셀 또는 Python 등의 프로그래밍 언어로 데이터 처리가 가능하신 분 (필수사항 아님) 제출서류 필수 제출서류 없음 전형단계...
https://kr.indeed.com/viewjob?jk=cb32ed51c4e0c7ad,DGIST 동반진단의료기술융합연구실 계약직 연구원 공개 초빙 공고,대구경북과학기술원 대구 현풍면,,"경험자 Matlab 또는 Python 활용 능력 우수자 C/C++... Java, Visual Basic, Python 등) 공학용 프로그래밍 활용 가능자(Matlab, Python 등) 자동차 관련 실험 연구..."
https://kr.indeed.com/viewjob?jk=e393fa440b668be7,Data Analyst,Toss 서울 강남구,,"소지하신 분 혹은 경험이 풍부하신 분 - Data Warehouse 구축 지식이나 경험이 있으신 분 - Python, R, Spark 등 언어 및 데이터 프로세싱 프레임워크에 대한 이해도가 높은 분 - 필요한 데이터를 스스로..."
https://kr.indeed.com/viewjob?jk=e36b5d6e4b5e5a88,(전액무료) 청년장애인 IT 인재육성 씨앗(SIAT) 교육 추가 / 교육...,중앙에이치티에이 성남 수정구,,게임>빅데이터·AI(인공지능)> Python|인터넷·IT·통신·모바일·게임... 로그래머>머신러닝(ML)|인터넷·IT·통신·모바일·게임>응용프로그래머> Python|인터넷·IT·통신·모바일·게임>응용프로그래머>증강현실(AR)|인터넷...
https://kr.indeed.com/viewjob?jk=02bcd7b6412d1db9,자율주행연구팀 연구사원 (신입/경력),소네트 대구 달성군,,"필수사항 - C / C++ / Python 언어 사용 가능자 • 우대사항... C++언어 사용 가능자 • 우대사항 - 운전 가능자 - JAVA / python 언어 사용 가능자 - 오픈소스 (OpenCV, ROS 등) 사용 경험..."
https://kr.indeed.com/viewjob?jk=d0ca27a97ddf91f9,엔미디어플랫폼 데이터베이스 관리자 (DBA) 인재 안내,리더스소프트 성남 분당구,,"운영 가능한 분 - DB관련 자격증 보유한 분 - 운영 자동화 스크립트(PowerShell, Shell, Python) 작성 가능한 분 - MongoDB, Redis에 관심 있으신 분 기타사항 - 서류 접수 이후 4주 이내로..."
https://kr.indeed.com/viewjob?jk=54ce47c4db974112,DGIST HumanLAB(인간중심지능형시스템연구실) 연수연구원 채용 공...,대구경북과학기술원 대구 현풍면,,경험자 Matlab 또는 Python 활용 능력 우수자 국가연구... 프트웨어 설계 및 구현 가능자 Matlab/Simulink 또는 Python 활용 능력 우수자 국가연구 개발(R&D)사업 참여 경험자 영어...
https://kr.indeed.com/viewjob?jk=f7aef0724a207b98,"Database Consultant, South Korea",EDB 경기도,,"scripting languages like BASH, KSH, Python, Perl etc.. Working knowledge of MS... like C, C++, PHP, python, Java or Ruby..."
https://kr.indeed.com/viewjob?jk=6bfec9fa5d0c15f5,1분기 개발자 (신입/경력),이스트게임즈 서울 서초구,,"C/C++, C#, Swift, Objective C, Kotlin, Java, JavaScript, Python, Go. - 새로운 프로그래밍 언어를 습득하는데 어려움이 없거나 혹은 흥미를 갖고 있는 분 - Windows..."
https://kr.indeed.com/viewjob?jk=385c58c7ced1d77b,데이터 사이언티스트를 지향하는 데이터 엔지니어 모집,카카오 4.0 성남 판교역,,"Spark 등 빅데이터 분석 플랫폼을 사용하여 대용량 데이터의 수집,가공이 가능한 분 프로그램 개발(Java, python 등) 기술을 보유하신 분 어떤 일이라도 중요하게 여기며 책임감 있게 진행할 수 있으신 분 자신의 생각..."
https://kr.indeed.com/viewjob?jk=b5ec5051cc998949,"[신입,경력] application 개발자",유즈브레인넷 서울 구로구,,"담당업무 자격요건 인원 MFC/Visual C++ [담당업무] - application - C, C++ - Python - 헬스케어 제품 어플 개발 - APP(iOS/Android) - 응용프로그래머 [근무부서 및 직급/직책..."
https://kr.indeed.com/viewjob?jk=af725f1c975c7581,"Technical Operations Manager, Premium Su...",Amazon Web Services Korea LLC 서울,,Programming in one or more... following languages - Java/ Python/ Ruby/ .NET/ Android/ iOS · Must have excellent oral...
https://kr.indeed.com/viewjob?jk=d29856ba80e4bc98,[누구랑 라라랑] (주)라라와 함께할 웹프로그래머,라라 부산,"월급 2,000,000원",mHTML|인터넷·IT·통신·모바일·게임>웹프로그래머>JAVA|인터넷·IT·통신·모바일·게임>웹프로그래머> Python|인터넷·IT·통신·모바일·게임>웹프로그래머>HDML|인터넷·IT·통신·모바일·게임>웹프로그래머>웹개발
https://kr.indeed.com/viewjob?jk=f70127e91faf757c,[조선해양/토목/기계] 엔지니어,포어시스 서울 마포구,"월급 3,000,000원 - 3,200,000원","이미지 프로세싱 전공자 - 해양쓰레기 차단막 운영시스템 개발을 위한 이미지 프로세싱 관련 전공자 우대 - Python, Matlab 등 프로그램 사용자(고급) 우대 ㆍ기계: 세부 전공 무관 - 수치시뮬레이션 가능자 우대 4..."
https://kr.indeed.com/viewjob?jk=be6c1f03fa566f8e,추천 시스템 연구/개발,카카오 4.0 성남 판교역,,"지원자격 개발 경력 3년 이상 적어도 하나 이상의 능숙한 프로그래밍 언어가 있으신 분 우대사항 Python, C++, GPU 프로그래밍 숙련자 TensorFlow, PyTorch, implicit 등 머신러닝/추천..."
https://kr.indeed.com/viewjob?jk=cc655f01166e576d,[연말인기과정] 자바·파이썬 개발자 양성 참여자 / 4차산업유망분야·취업...,한국직업전문학교 서울 구로구,,로젝트 제작 12월 9일 파이썬( Python)활용 디지털컨버전스 SW개발자... 웹프로그래머> Python|인터넷·IT·통신·모바일·게임>웹프로그래머>웹개발|인터넷·IT·통신·모바일·게임>빅데이터·AI(인공지능)> Python|인터넷...
https://kr.indeed.com/viewjob?jk=8291f4cc1fc52912,[라젠][청년디지털일자리지원사업] 빅데이터 수집 및 정보처리,라젠 광주 화정동,,"MTT 2.빅데이터수집 (음성,안면,모션) [업무시간] 오전 09시 ~ 오후 6시 [체크사항] 1.C, Python, Java 등 기본 언어 활용 (C언어 필수) 2.정보처리기사 및 소프트웨어 관련 자격증 우대 접수마감일..."
https://kr.indeed.com/viewjob?jk=3f8d4bf382f3ec64,반도체 디자인 검증 엔지니어,10년 연혁의 팹리스기업 서울 강남구,,"버깅 능력 - 디지털 회로 설계에 대한 지식 - 객체지향 프로그래밍(OOP)에 대한 이해 - C/C++, python, perl, tcl등 프로그래밍 언어에 대한 이해 • 참고사항 - 근무시간 : 주5일, 업무시간 flex..."
https://kr.indeed.com/viewjob?jk=116009dbf59211ed,퍼즐데이터 역량있는 데이터 분석가,주식회사퍼즐데이터 서울 역삼동,,"데이터 마이닝 및 통계분석에 대한 전반적인 이해 3. 관련분야(산업공학, 통계 등) 전공 4. R or Python 사용 능력 * 이런 분은 더욱 좋아요. 1. 프로세스 마이닝 지식 보유자 2. 관련분야 대학원 전공 3..."
https://kr.indeed.com/viewjob?jk=0e675e6e150d8798,[라젠]2021년 지역주도형 일자리사업「4차 산업혁명 IT인력 일자리창출...,라젠 광주 화정동,,"경될수 있습니다. ※ 자세한 사항은 첨부된 파일을 확인하시기 바랍니다. [체크사항] 1.Java, C, Python 등 기본 언어 활용 2.정보처리기사 및 소프트웨어 관련 자격증 우대 접수마감일 채용시까지 고용형태 기간의..."
https://kr.indeed.com/viewjob?jk=96f91c6618c0da6c,사회복지법인 아이들과미래재단 사업본부 직원 (~02.09),아이들과미래재단 서울 동작구,,"교육 및 기획 유경험자 우대 * EPL(Education Programming Language), C, Python 등 컴퓨터 언어 유경험자 * 아두이노, 마이크로비트, 라즈베리파이 등 오픈소스 하드웨어 유경험자 근무조건..."
https://kr.indeed.com/viewjob?jk=ad88a21945aedaf2,Cloud Support Engineer- Bigdata,Amazon Web Services Korea LLC 서울,,Intermediate programming/scripting skills. Ideally in Java or Python... consider experience in other Object Oriented...
https://kr.indeed.com/viewjob?jk=5a349ecd72559c9f,시스템엔지니어 신입/경력 정규직,메에먼트 서울 강남구,"연봉 30,000,000원 - 35,000,000원","Virtual private cloud 를 통한 폐쇄망 구축 경험 *자동화 script ( bash, python, golang등) 개발운영 경험 우대사항 *다양한 트러블 슈팅 경험 (장애 프로파일링) *대용량 트래픽 분산처..."
https://kr.indeed.com/viewjob?jk=3e80435be74cd28f,블록체인인터넷경제연구센터 위촉연구원,광주과학기술원 광주 북구,,업무) 지원자격 연구직 O명 블록체인 연구 및 프로그래밍 제작 1) SW프로그래밍 제작 경험자 2) Python/C/Java/Go 프로그래밍 가능자 3) 블록체인 개발 경험자 우대 4) 컴퓨터공학 및 컴퓨터사이...
https://kr.indeed.com/viewjob?jk=b8c6ad4bd3f32e3d,AI 개발자,넷아이디 서울 강남구,"연봉 35,000,000원 - 40,000,000원",인터넷·IT·통신·모바일·게임>응용프로그래머>머신러닝(ML)|인터넷·IT·통신·모바일·게임>응용프로그래머> Python|인터넷·IT·통신·모바일·게임>ERP·시스템분석·설계>인공지능(AI)서비스기획|인터넷·IT·통신·모바일...
https://kr.indeed.com/viewjob?jk=7609462290636e5d,지스트 블록체인인터넷경제연구센터 계약직(박사급 연구원),광주과학기술원 광주 북구,,기획 블록체인 연구·개발·하드포크 1) 박사 이상 졸업자 2) SW프로그래밍 제작 경험자 3) Python/C/Java/Go 프로그래밍 가능자 우대사항 ① 국가보훈대상자(취업보호대상자) 및 장애인은 관련 법령에...
https://kr.indeed.com/viewjob?jk=7af6301dc691d3ab,Data Scientist,Toss 서울 강남구,,"실무 경험 5년 이상 갖추신 분 - 실제 서비스 데이터를 이용한 분석모델 개발 경험이 있으신 분 - R, Python, Scala, SQL 등 데이터 분석의 업무를 수행할 수 있는 하나 이상의 개발 언어에 능숙하신 분 #..."
https://kr.indeed.com/viewjob?jk=b74cd0ba29a65a46,Web Developer,NeuToy (Subsidiary of the holographic software com... 서울,"연봉 25,000,000원 - 40,000,000원",NodeJS React.js Python Bonus Skills... 필수) EC2: 1년 (필수) * Mysql: 2년 (필수) * Python: 3년 (필수) * React.js: 2년 (필수) 학력: * 대학...
https://kr.indeed.com/viewjob?jk=01b54b2273585e2e,IT직군 채용(직무: 데이터 엔지니어),웅진 서울 종로구,,"이터 수집/처리/적재 개발 및 운영 2) 데이터 처리 개발(JAVA, Python, Scala) 3) 빅데이터 플랫폼 운영(Spark, Kinesis... 언어 활용 가능한분(JAVA, Python, Scala) - 병역필 또는..."
https://kr.indeed.com/viewjob?jk=23dfc13905f7fcc0,[Search] Knowledge Base Applications (신입...,네이버 서울,,"이터 수집 및 취합 - 빅데이터 기술을 이용한 데이터 분석 - 데이터 시각화 [필요기술] - Java/ Python/Scala 중 최소 1 가지이상 숙련자 - Web(HTML, JS, D3 ) [우대사항] - 대용량 데이..."
https://kr.indeed.com/viewjob?jk=7fdcd7a7457b1e93,데이터 분석,아프리카TV 경기도 성남,,"의 서비스 이용/소비형태/이상현상과 트렌드 변화가 궁금하신 분 - B2C서비스 데이터 분석 직군에서 데이터 핸들링 경험이 있으신 분 - SQL,Excel,R, Python 등을 이용하여 데이터 추출 또는 분석이 가능하신 분"
https://kr.indeed.com/viewjob?jk=85687b250386c4be,qe 소프트웨어 엔지니어,에이치알 코리아 대한민국,,"process improvements • Strong scripting experience with Python, Shell Scripts, Ruby, etc. • Ability to code competently..."
https://kr.indeed.com/viewjob?jk=504b2c9de66ef96d,"기술연구소 정규직 연력(Java, Python, 기타)및 개발자 (신입,...",파인씨앤아이 서울 송파구,"연봉 30,000,000원 - 60,000,000원","웨어 개발 및 AI, 통계분석I) - 경력 : Java 개발경험 2년이상 -개발언어 : Java, C++, Python, Node 등 [근무시간 및 형태] 주 5일 근무 (오전) 9시 00분~(오후) 6시 00분 주소정근로시..."
https://kr.indeed.com/viewjob?jk=d5a4422a80e4a409,(주)엘솔루 웹 개발자,㈜엘솔루 서울,,Javascript / React / Python / NodeJS 개발... Stack 개발 유경험자 ㆍJavascript / React / Python / NodeJS 개발 유경험자 ㆍHTML 5 개발 가능자(필수) 1명...
https://kr.indeed.com/viewjob?jk=8dfcac57b93113ea,[TmaxBI/기술] 빅데이터 플랫폼 QA,티맥스소프트 성남 분당구,,"갖춘자 - ERP/CRM 역량 보유자 - 데이터분석/모델링 역량 보유자 우대사항 - 보유기술: Java, python, RDB, NoSQL, OS(linux), Selenium, docker, Kubernetis - 자격사항..."
https://kr.indeed.com/viewjob?jk=a746de9c7a6168ef,Healthcare Real World Data Analyst 담당자,IQVIA 서울,,"HEOR 전반적인 업무 수행 Qualifications Claims Data 관련 분석 경력자 SAS / Python / R 등 통계 프로그래밍 언어 사용 가능자 통계학 전공자, 통계 및 Epidemiology 관련 석사..."
https://kr.indeed.com/viewjob?jk=94f4ff49978459bc,Associate Solutions Architect,Amazon Web Services Korea LLC 서울,,"languages... Ruby, Python and Node... 현대 개발 언어에 대한 실무적 지식: 루비 (Ruby), 파이썬 ( Python), Node.js 등 · 개발자 및 IT 운영자 대상의 신기술 전파에..."
https://kr.indeed.com/viewjob?jk=74cf47be676133ff,DGIST 미래자동차융합연구센터 계약직 연구원 및 연수연구원 공개 초빙...,대구경북과학기술원 대구 현풍면,,"기술개발 우대 사항 우대사항 - S/W개발능력, C,C++, Python,Matlab 등 능숙자 - 자율주행 및 ADAS관련 프로젝트 참여경... W개발능력, C,C++, Python,Matlab 등 능숙자 - 자율주행..."
https://kr.indeed.com/viewjob?jk=beaf31828719882c,[공통기술부문] AI / ML 엔지니어 (3년 이상),우아한 형제들 서울 송파구,,"수정할 수 있는 분 - 3년 이상의 실무 경험, 1개 이상의 ""숙련된"" 프로그래밍 언어 활용 능력(ex. Python, C++ 등)을 가진 분 - 원천 데이터를 탐색, 검증, 취합하는 단계부터 모델의 구현, 학습, 배포까지..."
https://kr.indeed.com/viewjob?jk=2892c67308e87f01,Field Data Scientist,Success Korea 경기도,,"Scripting experience required (e.g. Matlab, R, Python). Familiarity with analytics... e.g. Matlab, R, Python). Familiarity..."
https://kr.indeed.com/viewjob?jk=741cc6ac364ea9be,Internal Infra Engineer,Toss 서울 강남구,,분 # 우대 사항 - Nutanix/VMWare 구축 운영 경험이 있으신 분 - Powershell 또는 Python 등을 사용한 시스템 관리 자동화 경험이 있으신 분 - 100명 이상 규모의 L3/L4 네트워크 관리 또는...
https://kr.indeed.com/viewjob?jk=bd5ce1a809ec610a,Modem QA Contractor,聯發科技 경기도 성남,,4. Good verbal and written communication skills in English 5. Prefer programing experience(C/JAVA/ Python #LI-NOPOST
https://kr.indeed.com/viewjob?jk=082bf625e94f1da2,[유망 벤처기업] 데이터사이언티스트,인코리아 프로페셔널 서울 강남구,,교육 이수자 통계적 데이터 분석 및 머신러닝 관련 분야 경력 3년 이상 Python을 통한 데이터 분석 능력을 갖추신 분 데이터팀 셋팅 및 리딩 경험... 게임>빅데이터·AI(인공지능)> Python|인터넷·IT·통신·모바일·게임...
https://kr.indeed.com/viewjob?jk=df21e3bb5d773616,Python Programmer,Mofac 서울 서초구,,개발 – JAVA 프로그래밍(라이브러리 활용) – Spring 프레임 워크 개발 – Python API 프로그래밍 우대사항 – Python 개발 경험 – Open Source 라이브러리 개발경험 – Web 표준에 대한 경험...
https://kr.indeed.com/viewjob?jk=9edef5cb1029c4c1,데이터 마케팅(분석/모델링) 전문가,LG전자 3.8 서울 영등포구,,"머신러닝/딥러닝을 이용한 분석 역량 및 경험 . 모델링을 위한 데이터 전처리 및 가공 실무 경험 . R, Python을 활용한 모델링 설계 및 구현 (지도 학습 및 비지도 학습 주요 모델 활용 능력 및 시계열 분석 모델 활용..."
https://kr.indeed.com/viewjob?jk=3c516818303c4d51,Application Engineer ( Silicondash),Synopsys 서울,,"disk access Programming skill of TCL, Perl, JavaScript or Python Good documentation and reporting skills are required..."
https://kr.indeed.com/viewjob?jk=ddd1f037549e47a2,"솔루션 개발자, 품질인력 채용",한화그룹 4.2 서울,,"Python 및 기타 프로그래밍 언어 능숙자(C/C++/C#/Java/PHP) 윈도우 및 리눅스 운영체제 활용 능숙자 IP 네트워크, 운영체제, 데이터베이스 등 CS 기본 지식 서버사이드스크립트( Python/PHP..."
https://kr.indeed.com/viewjob?jk=092d062a6faa7139,데이터 분석가 모집,카카오 4.0 성남 판교역,,"이터 분석 지원자격 데이터 분석 업무를 수행할 수 있는 하나 이상의 언어 스킬 필수 (예. SQL, Python, R 등) 데이터 기반 프로젝트 경험이 있으신 분 (예: 통계 분석 프로젝트) 어떤 일이라도 중요하게 여기..."
https://kr.indeed.com/viewjob?jk=2cfd15907402c5cc,DGIST 제2차 계약직 연구원 채용공고,대구경북과학기술원 대구 현풍면,,천원 이내 수행 내용 Machine learning (Deep learning) 알고리즘 개발 Python/Tensorflow 프로그래밍 Matlab/simulink 모의실험 자율주행 자동차 혹은 전문 서비...
https://kr.indeed.com/viewjob?jk=94e6b51a16f4a0f6,Perception Software Engineer - Autonomou...,NVIDIA 대한민국,,work experience. Strong programming skills in C++ and python. Hands-on experience in developing algorithms for state...
https://kr.indeed.com/viewjob?jk=cd40cf786e32f325,사내 및 서비스 보안 담당자 (경력),네오위즈 대한민국,,"GuardDuty, WAF, VPC Flow Logs 분석 등)이 있으신 분 - 각종 스크립트 언어(Perl, Python, shell script 등)의 활용 능력을 가진 분 - 모바일 게임 앱에 대한 보안 검수 경험이..."
https://kr.indeed.com/viewjob?jk=f0ebe714bb940da2,엔지니어,키사이트테크놀로지스 서울,,"region teams • Instrument programming coding skill (C#, Python) preferred 제출서류 - 제출서류는 일체 반환하지 않음 마감일 채용시 전형방법 서류-1차면접-2차면접..."
https://kr.indeed.com/viewjob?jk=69ab0f58743cb713,21년 전문연구요원 (AI엔지니어),Nexon 성남 분당구,,"대상자 - 병역의무가 없거나 면제된 분, 병역의 의무를 마치신 분은 본 공고의 대상에서 제외됨 - Python에 숙련된 프로그래밍 능력과 머신러닝 라이브러리 활용 경험 - 머신러닝과 강화학습에 관련된 지식 습득 혹은..."
https://kr.indeed.com/viewjob?jk=927439a84026234e,[빅데이터플랫폼] 데이터 엔지니어,한국카카오은행 성남 분당구,,"Kafka, Flink 등을 사용한 대용량 데이터 처리에 능숙한 분 · Java, Kotlin, Python 중 하나 이상의 언어에 익숙한 분 · 총 경력이 3년 이상인 분 우대사항 · Hadoop EcoSystem 기반의..."
https://kr.indeed.com/viewjob?jk=4f61daa017b07bae,[AI R&D] ML 엔지니어 모집,엔씨소프트 2.7 성남 판교역,,개발 지원자격 학력 : 학사 이상 경력기간 : 3년 ~ 필수조건 - ML에 주로 사용되는 언어(R/ Python)에 능숙하신 분 - ML 도구(scikit-learn/Spark MLlib/Tensorflow/Pytorch 등...
https://kr.indeed.com/viewjob?jk=da5c549bf1a76ded,데이터 사이언스(데이터 모델링 및 추천 모델링),NHN 4.4 성남 판교역,,"AB테스트, 결과 해석 등) - 리눅스 환경에서 머신 러닝 및 데이터 분석 관련 언어, 라이브러리( Python, R, SQL, tensorflow 등) 능숙한 활용 - 머신러닝, 추천 , 딥러닝 관련 논문을..."
https://kr.indeed.com/viewjob?jk=2b2dcd3ffe3d53df,카카오 데이터의 가치를 발굴할 데이터 분석가 모집,카카오 4.0 성남 판교역,,"기술 통계량 이해 및 해석) 데이터 분석 업무를 수행할 수 있는 언어 스킬 필수 SQL 필수 R 또는 Python을 다룰 수 있는 분 (SAS, SPSS, GA, tableau 등 통계 툴만 사용 가능한 경우 제외) 하둡..."
https://kr.indeed.com/viewjob?jk=010d38b18b07b6bb,데이터 분야 경력,LG CNS 3.7 서울,,"해가 뛰어난 자 - R, Python, SAS, SQL 등 활용 역량 우대사항(해당 내용 중 1개 이상) - ML/DL 경험 인력 우대 - 관련 분야 석사 이상 학위 소지자 우대 - R, Python등 데이터분석 모델링 경험..."
https://kr.indeed.com/viewjob?jk=54e0d08c99dcf507,MI(Market Intelligence)담당 마케팅 전략 경력사원,LG전자 3.8 서울 영등포구,,"마케팅 전략/방향성 도출 경험 보유 4) 우대 사항 - 통계 분석 및 프로그래밍 언어 역량 보유: R, python, Java, SPSS, Tableau, etc. - 영어 능통 역량: 해외법인과 영어 화상 회의 및 현지..."
https://kr.indeed.com/viewjob?jk=cd2ef993ee5c8d3f,지스트 블록체인인터넷경제연구센터 계약직(연구원),광주과학기술원 광주 북구,,록체인 개발 블록체인 하드포크 1) 4년제 대학 이상 졸업자 2) SW프로그래밍 제작 경험자 3) Python/C/Java/Go 프로그래밍 가능자 4) 팀장급은 개발 경험 10년 이상인 자 연구직 1명 우대사...
https://kr.indeed.com/viewjob?jk=e934bb33ef71dacb,[EY한영] 금융감사본부 Data Analytics 전문 경력직 모집,Ernst & Young 4.0 대한민국,,총계정원장조정 경험자 - Python/R 등 프로그램 언어 활용 능력... PowerBI... Tableau Experience with Python/ R or other programming languages...
