ID,Title,Location,Salary,Summary
https://kr.indeed.com/viewjob?jk=69e29038ecc0f40f,SM파견 웹개발자,유저해빗 인천 서구,"연봉 40,000,000원 - 50,000,000원","유지보수 - Python 기반 웹 유지보수 -Spring 기반 프로그램 유지보수 -기타 서비스 운영 관리 [근무부서 및 직급/직책] 근무부서: 개발팀 직급/직책: 사원, 팀원 [자격요건] -Java 혹은 python 웹 경력..."
https://kr.indeed.com/viewjob?jk=afe92c03320fe1b3,카카오 광고 서비스 알고리즘 및 시스템 개발,카카오 4.0 성남 판교역,,"함께 하고 싶습니다. 지원자격(공통) 하나 이상의 프로그래밍 언어에 익숙한 분 (C/C++, Java, Python, Go, Scala 등) [알고리즘 개발 업무 관련 지원 경우] 데이터 마이닝 또는 머신러닝 지식/경험이..."
https://kr.indeed.com/viewjob?jk=1e974ff27c6eb340,Autonomous Driving 분야 엔지니어,포티투닷 서울 강남구,,"프로그래밍 기술 (C/C++, Python 등) - 이동 로봇/드론 관련... platform 개발 경험 - 뛰어난 프로그래밍 기술 (C/C++, Python) - 3D geometry, math, physics 관련 경험 및..."
https://kr.indeed.com/viewjob?jk=b2ef9dc168ce46f0,FDS 데이터 분석 담당자,네이버 서울,,"운영 [자격요건] - FDS 데이터 모델링 관련 업무 2년 이상 - 대용량 데이터 분석 가능자 (SAS, R, Python) - 머신러닝/딥러닝의 주요 방법론을 실제로 수행해 본 적이 있으신 분 - Hadoop (Hive..."
https://kr.indeed.com/viewjob?jk=e646273cb91744c6,"Pre Sales AE, Expert",Keysight Technologies 서울,,"inter-region teams • Instrument programming coding skill (C#, Python) preferred Job Function Support / Service..."
https://kr.indeed.com/viewjob?jk=793d3bdf17f3593f,연구소 개발부문 연구원 직원 (회로설계/하드웨어설계/머신비전/이미지프로세...,모든 경기도 광명,"연봉 42,000,000원 - 46,000,000원","프로그래밍 가능자 우대 S/W 설계 부문 : - OPEN CV, TENSORFLOW, YOLO, CUDA/ Python, C++, C WindowsGUL APL, MFC Lib 활용 가능자. 머신비전/ 영상처리 개발자 * 전기..."
https://kr.indeed.com/viewjob?jk=a0dda478567db352,"(주)트윔 개발자(경력직) 빅데이터,영상처리,머신비전/AI 딥러닝",트윔 경기도 화성,,"자기주도적으로 진행한 경험 - Python/C/C++ 능통자 - 데이터... RNN 등 딥러닝 이론 및 알고리즘 유경험자 - C/C++, Java, Python/TensorFlow/Caffe 사용가능자 - Matlab/R 분석..."
https://kr.indeed.com/viewjob?jk=4bd70fb8a220d90d,[Janssen] Data Scientist,Johnson & Johnson Family of Companies 4.2 서울,,"Expertise in one or more programming languages... R, Python or SAS. 7. Knowledge of relational database architecture..."
https://kr.indeed.com/viewjob?jk=3c2a60ffd9a25a10,[NIT Service] NAVER IDC 서버 운영/관리(가산),엔아이티서비스 서울 금천구,,"application 운영 경험 - Shell script, python 활용 가능 - 해외 데이터센터 인프라 구축 또는 운영 경험 - 국가보훈대상자... 경험 - Shell script, python 활용 가능 - 해외 데이터센..."
https://kr.indeed.com/viewjob?jk=04d685fc70b67d4e,Linux/Python/PHP/MySQL/백엔드 정규직 경력,일루미나리안 용인 보정동,,"보유 - DBMS(MySQL or MariaDB), scripting Language: bash, python, OOP 언어 중 가능자 - Back-End 서버를 개발해 보신 분 [우대사항] - Go(aka GoLang..."
https://kr.indeed.com/viewjob?jk=15138984e56b0b7a,Cloud Infrastructure Developer,SAP 4.3 서울,,Your tasks will include developing a python based scalable job execution platform... development with Python Experience...
https://kr.indeed.com/viewjob?jk=5a299cf580491445,게임 데이터 분석가,쿡앱스 성남 분당구,,"데이터를 기반으로 한 커뮤니케이션 능력을 갖추신 분 수리적 직관 및 통찰력을 가지고 계신 분 우대사항 R, Python,Scala,SQL등의 툴을 이용한 데이터 분석 업무경험이 있으신 분 데이터 마이닝 및 머신러닝 관련 지식을..."
https://kr.indeed.com/viewjob?jk=1e95ae909de993eb,Solution Sales Architect,"FireEye, Inc. 서울",,Reasonable knowledge of key technologies including SIEM/SOAR/EDR/TIP Optional: Desired expertise in scripting (e.g. python)
https://kr.indeed.com/viewjob?jk=19b7736d5aa3f7e5,Machine Learning Research - Speech Recog...,Qualcomm Korea YH 서울,,experience in machine learning Programming skill in Python or C/C++ Experience in PyTorch (preferred) or TensorFlow...
https://kr.indeed.com/viewjob?jk=0019db89120acd75,"서버/클라이언트 Application 개발, java, 웹개발 기술연구소...",굿링크 경상남도 진주,"연봉 25,000,000원 - 30,000,000원","이언트 Java Application 개발 Java, Java script, HTML, DataBase, python framework, 웹개발 [우대사항] ㆍ전기/전자공학, 컴퓨터/시스템공학 ㆍ정보처리기사 우대 ㆍ제품 개발..."
https://kr.indeed.com/viewjob?jk=db55ee61f98e6816,DGIST 동반진단의료기술융합연구실 계약직 연구원 채용 공고,대구경북과학기술원 대구 현풍면,,데이터 통계 분석 AI 기반 데이터 분석을 위한 대용량 고속 데이터 처리 DB 구축 우대 사항 Python/Jave 기반 생체 정보 데이터 분석 경험자 대용량 고속 데이터 처리 DB 구축 경험자 급여수준...
https://kr.indeed.com/viewjob?jk=9ab2041ab3380a21,카카오톡 안티어뷰징을 위한 데이터/백엔드 엔지니어 및 머신러닝 전문가 모...,카카오 4.0 성남 판교역,,"Engineer, Data Scientist 해당 분야에서 활용되는 언어 및 도구를 능숙하게 다룰 수 있는 분( Python, Scala, PyMC, PySpark, Tensorflow 등) 우대 사항 컨테이너 환경에서의..."
https://kr.indeed.com/viewjob?jk=e26f899b8accca1a,Datacenter Engineer (강원도 춘천 근무),Oracle 3.8 서울,,"Base Operating System Install • Some experience with Perl, Python, Bash or Java • Core OS Services: ssh, telnet, ftp, nfs..."
https://kr.indeed.com/viewjob?jk=8d208778abed5b56,화장품 회사 데이터 사이언티스트,에이치앤티어세스 서울 서초구,,"통해 비즈니스와 기술 적용의 기회를 발굴할 수 있는 분 ㄷ. SQL, Python /R , Tableau등으로 데이터 분석 업무를 수행할 수 있는 분... 게임>빅데이터·AI(인공지능)> Python|마케팅·광고·홍보·조사>마케팅>마케팅기획"
https://kr.indeed.com/viewjob?jk=5cb14c0712a6c4c1,시스템 엔지니어링,NHN 4.4 성남 판교역,,"Windows OS 스킬 보유 및 X86 서버 운영 경험 보유 - 기본적인 운영도구 개발 가능자 * Python, Django, JAVA - 웹 서비스 또는 플랫폼 개발 경력 보유자 - OpenStack 기반의..."
https://kr.indeed.com/viewjob?jk=25725b3c0e607311,Junior Quant Trader,Byzantine Partners 서울,,background is a plus Programming capability is mandatory (i.e. Python) Understanding of machine learning algorithm is a plus...
https://kr.indeed.com/viewjob?jk=8bcc7807085700a7,클라우드 오퍼레이션 엔지니어,NHN SOFT 4.4 성남 판교역,,"Linux, Windows Server 트러블 슈팅 숙련자 - 2년 이상의 개발 경험자(PHP, Python 등) - 아래 기술 분야중 1개 이상의 풍부한 지식 및 운영 경험 보유자 (ElasticSearch..."
https://kr.indeed.com/viewjob?jk=fcb8e979d835313e,물류센터 최적화 분석 담당자,이베이 코리아 서울 강남구,,"커뮤니케이션 가능하신 분 - 산업공학 , 전산 , 통계학과 우대 - SQL 중급 이상 가능하신 분 - R, Python 경험자 우대 [공통요건] - 학사(4년제)이상 - G마켓/옥션으로 회원가입이 되어있는 분 - 해외여행..."
https://kr.indeed.com/viewjob?jk=0fb5acdbc8a15af9,Principal Solutions Integration Develope...,Nuance 서울,,Scripting Languages (at least 3... following) Java Python C / C++ Golang Javascript / Node.js React / Vue.js / Angular...
https://kr.indeed.com/viewjob?jk=4ec7c9f47a7bae7f,[웹젠] 게임보안(경력),웹젠 성남 분당구,,PC/AOS/IOS 어플리케이션 리버싱 가능한 분 - C/C++/ Python/Java 등 개발 능력을 보유한 분 - 암호화 / 네트워크 /DB 등... 리버싱 가능한 분 - C/C++/ Python/Java 등 개발 능력을 보유...
https://kr.indeed.com/viewjob?jk=32b86c150b70d92a,엔미디어플랫폼 데이터베이스 관리자 (DBA) 인재 안내,엔미디어플랫폼 성남 분당구,,"운영 가능한 분 - DB관련 자격증 보유한 분 - 운영 자동화 스크립트(PowerShell, Shell, Python) 작성 가능한 분 - MongoDB, Redis에 관심 있으신 분 기타사항 - 서류 접수 이후 4주 이내로..."
https://kr.indeed.com/viewjob?jk=73f619e964a56a10,[전문연구요원] ML/DL 연구원 및 SW 개발자,뷰노코리아 서울 서초구,,"Python, Javascript, Go, Java, C++, C# 중 최소 1개 이상의 언어에 익숙하신 분 - (우대) Python/Flask로... 그래머> Python|인터넷·IT·통신·모바일·게임>웹프로그래머> Python..."
https://kr.indeed.com/viewjob?jk=b602108c31558329,리서치분야 석사이상 경력직,케이지제로인 대한민국,,"티팩터 리서치 2. 펀드, 금융 및 재무데이터 분석 3. 기업재무 관련 리서치 4. 기관 컨설팅 5. R, Python을 활용한 로직 개발 자격 요건 석사이상, 경력 3년이상, 경제학, 재무금융 전공자 우대사항 CFA..."
https://kr.indeed.com/viewjob?jk=85929aac498299cc,데이터 사이언스 전문가 및 머신러닝 전문가 모집,카카오 4.0 성남 판교역,,명시해 주시기 바랍니다. 지원자격 개발 경력 2년 이상 머신 러닝/데이터 사이언스를 위한 언어(R/ Python/Scala) 및 도구(scikit-learn/Spark MLlib/Tensorflow/Pytorch 등)를...
https://kr.indeed.com/viewjob?jk=914578ba5310e818,Software Development Engineer,Mentor Graphics (Korea) LLC 4.0 경기도 성남,,data analysis Developing high performance software in python/programming language; Expertise in various software development...
https://kr.indeed.com/viewjob?jk=e8a4630bec0783e8,2021 Market Data Analyst - Seoul,Bloomberg 서울,,"work experience using one more programming language... Python, SQL and R Fluency in Korean and English (both spoken..."
https://kr.indeed.com/viewjob?jk=1748baa27965fdbf,"MVP 개발 엔지니어(서버, 웹프론트) (정규직, 계약직, 프리랜서)",더테스터 대전 중구,,1년 이상의 서버 개발 경험 · 아래 옵션 중 하나의 기술 스택 사용 - JAVA기반의 Spring - Python 기반의 Django - Ruby 기반의 Rails 우대사항 · 팀단위로 프로젝트를 수주해본 적 있는...
https://kr.indeed.com/viewjob?jk=9acc17c535b42959,2021년 (신입) 전문연구요원 모집,NHN 4.4 성남 판교역,,"연구 및 개발 경험 - Python/C++/Java/C# 개발 경험... 머신러닝/딥러닝/음성인식/ 음성합성 연구 및 개발 경험 - Python/C++/Java/C# 개발 경험 - 전기전자, 정보통신, 컴퓨터 관련..."
https://kr.indeed.com/viewjob?jk=444320d2e49672dc,"Application Engineer South Korea (Physics, EE)",Zurich Instruments 대한민국,,"Experience in programming languages LabVIEW, MATLAB, Python or C is a plus. Availability to travel, around 25%. Moreover, we..."
https://kr.indeed.com/viewjob?jk=3330430ae94277db,[타다]데이터 분석가/사이언티스트,쏘카 대한민국,,"통계에 대한 지식 및 머신러닝에 대한 지식을 보유하고 있으며, 데이터 분석 실무 경험이 풍부하신 분 • R, Python(Pandas, Numpy, Scikit-learn) 등의 데이터 분석을 위한 언어를 1개 이상 능숙하게..."
https://kr.indeed.com/viewjob?jk=74b3d3c938870be2,Data Scientist,Motion2AI 서울,,"thinking to define unstructured problems - Experience with Python (pandas, numpy), R, SQL... VBA to deal... large..."
https://kr.indeed.com/viewjob?jk=9fe4755841bec8ce,"데이터 분석 및 컨설팅 분야 (Python, SAS, 빅데이터) 경력직",한국정보기술단 과천 과천시,,"데이터 분석 및 컨설팅 분야 ( Python, SAS, 빅데이터) 경력직... 대졸 이상 (학사 이상 우대) - 데이터 분석 분야 경력 2년 이상 ( Python, R, SAS 기반의 DATA Preparation, 통계, 머신러..."
https://kr.indeed.com/viewjob?jk=efb69a29d8bd7514,2021년 IITP 주관 글로벌핵심인재양성 지원사업,정보통신기획평가원 대전 유성구,,인공지능)>빅데이터|인터넷·IT·통신·모바일·게임>빅데이터·AI(인공지능)>인공지능(AI)|인터넷·IT·통신·모바일·게임>빅데이터·AI(인공지능)> Python|인터넷·IT·통신·모바일·게임>빅데이터·AI(인공지능)>데이터분석
https://kr.indeed.com/viewjob?jk=5d4ef5faadd96b30,"[대성] 개발자 채용 | 앱개발,Java,Python,objective",대성 관심기업 전주 팔복동,"연봉 25,000,000원 - 30,000,000원","근무조건 정규직 급여 2500~3000만원 주 5일 | 오전 9시~오후 6시 undefined 전주시, undefined 전북전체 지원자격 신입, 경력 무관, 경력무관 학력무관 우대조건 해당업무 인턴경험, 해당업무 근무..."
https://kr.indeed.com/viewjob?jk=3805907e10c94ad1,생산기술연구팀 개발자 연구원,에이스트로닉스 대전 유성구,,"학력사항: 대학(2,3년)졸업 이상 [필수사항] - C / C++ / Python 언어 사용 가능자 - Windows, 임베디드 리눅스 기반 시스템... 통신·모바일·게임>응용프로그래머> Python|인터넷·IT·통신·모바일·게임..."
https://kr.indeed.com/viewjob?jk=df607996134e60ff,스테코 부문별 신입 및 경력사원,스테코 천안 서북구,,"알고리즘 개발 ※ C/C++ , Python , 할콘 library 개발... 데이터 처리 개발 경험 - HTML5기반 Web 시스템 개발 경험 - Python개발 경험 인사팀 인문계열 0명 ㆍ스테코 인사담당 업무 - 인사기획..."
https://kr.indeed.com/viewjob?jk=60495f8f583de7aa,2021년 각 부문별 경력직 공개,SK디앤디㈜ 성남 분당구,,"Collection, Data Pipeline, Data Warehouse 구축 경험 3년 이상 ㆍ우대 사항 - Python / Java(Scala) 등을 이용하여 데이터 처리 개발 가능 - 대용량 데이터 분석 및 빅데이터..."
https://kr.indeed.com/viewjob?jk=0592fae45af22542,2021년 상반기 Python 경력,매크로액트 성남 분당구,,1년이상) 학력 학력무관 성별 무관 기타 담당업무 2021년 상반기 Python 경력 채용 커리어 양식 지원 상세모집요강 접수기간/방법 지원방법... 산업 직무별(직종) 웹프로그래머 Python 응용프로그래머응용프로그래머 산업...
https://kr.indeed.com/viewjob?jk=dfb20fa220f3c478,"빅데이터, 인공지능(AI) 외 신입/경력 인턴",스칼라웍스 대한민국,,인공지능)>인공지능(AI)|인터넷·IT·통신·모바일·게임>빅데이터·AI(인공지능)>데이터분석|인터넷·IT·통신·모바일·게임>빅데이터·AI(인공지능)> Python|인터넷·IT·통신·모바일·게임>빅데이터·AI(인공지능)>딥러닝
https://kr.indeed.com/viewjob?jk=0902a0487b3b69a9,2021년도 한국알프스 수시,한국알프스 광주 광산구,,상검사를 통한 외관검사 *우대사항* □C# 가능자 □.NET 가능자 □Halcon or Cognex 가능자 □ Python 가능자 광주 신입/경력 제조공정관리 초대졸 기계/전기/전자 공학 및 유사 전공 * 공정편성 및 LINE...
https://kr.indeed.com/viewjob?jk=233bbfd9781e846d,"Engr, Tech Supp 3",KLA-Tencor 대한민국,,background Excel macro/code development for log analysis Python Database development for production Open to NCG (New College...
https://kr.indeed.com/viewjob?jk=68486bb7da29a05b,Application Engineer Consultant - HAV,Mentor Graphics (Korea) LLC 4.0 경기도 성남,,"Proficient in scripting languages used today. (e.g., Perl, Python, various shell scripts/Makefiles, XML, JSON, etc.) Good..."
https://kr.indeed.com/viewjob?jk=c3c9f36cd3a8c314,"연구개발, it개발 신입/경력 정규직",포엔 대전 유성구,,"가능)(연구원, 주임연구원급) [우대사항-IT 개발] ㆍ컴퓨터공학 ㆍ Python(numpy, pandas, scikit-learn, sympy) ㆍ... 통신·모바일·게임>웹프로그래머> Python|인터넷·IT·통신·모바일·게임..."
https://kr.indeed.com/viewjob?jk=fd0194167a01fed0,지능형자동차부품진흥원 인력,지능형자동차부품진흥원 대구 달성군,,통신·모바일·게임>빅데이터·AI(인공지능)>딥러닝|인터넷·IT·통신·모바일·게임>빅데이터·AI(인공지능)> Python|인터넷·IT·통신·모바일·게임>빅데이터·AI(인공지능)>무인 자동차 엔지니어|전자·기계·기술·화학·연구개발...
https://kr.indeed.com/viewjob?jk=55584c627df1acaa,데이터 분석가/사이언티스트(신입/인턴 가능),쏘카 대한민국,,"Sheet) 등 데이터 분석 도구를 원활히 다루시거나, 앞으로 원활히 다루고자 하는 의지가 높으신 분 • Python, R 등의 프로그래밍 언어 혹은 데이터 분석 언어를 1개 이상 능숙하게 사용 가능하신 분 전형절차 서류..."
https://kr.indeed.com/viewjob?jk=c8bf4fa58999927f,AI 분야 경력,LG CNS 3.7 서울특별시,,"이상 (AI 관련 논문 발표) ② AI/딥러닝 알고리즘 연구개발 프로젝트 경험 ③ Ubuntu Linux, Python, Tensorflow, PyTorch 사용 중상급 이상 우대사항(해당 내용 중 1개 이상) ① AI/머신..."
https://kr.indeed.com/viewjob?jk=b9b5a48d2121caca,Life Actuarial Analyst - Korea,Willis Towers Watson 서울,,"Familiarity with programming tool... SAS, DB2, R, Python preferred Bachelors Degree required Actuarial exam progress..."
https://kr.indeed.com/viewjob?jk=0feb2770202a5be1,(주)넷타겟 연구원 (웹프론트엔드 개발자),넷타겟 대전 유성구,,"bash, python, 등)으로 기존에 작성된 다양한 과학계산 코드들을 웹서비스의 형태로 구현하기 - 과학계산 Software API( Python... Django framework( Python) 에 대한 이해 - 새로운 기술..."
https://kr.indeed.com/viewjob?jk=0d207415a075d21c,Data Scientist (KOREA),No Deviation Pte Ltd 충청북도 청주,,"data visualization - Experience using tools... SAS JMP, Python, Matlab, KNIME, and SIMCA - Experience with developing..."
https://kr.indeed.com/viewjob?jk=52f8fb3f7e662c5d,[카카오커머스] 기술직군,카카오커머스 성남 분당구,,"Keras, Pytorch 등) - Python을 활용한 머신러닝/딥러닝... 이상 사용 경험이 있으신 분 - 프로그램 개발(Java, Scala, Python 등) 중급 이상 기술 보유하신 분 - 대용량 데이터에 대한 실시간..."
https://kr.indeed.com/viewjob?jk=b6f60e1ac5501c9c,Software Engineer - AI,GE Appliances 경기도 성남,,"lite, TensorRT. 5+ years of programming experience in Python, C/C++ Experiences working on deep learning model optimization..."
https://kr.indeed.com/viewjob?jk=4f61daa017b07bae,[AI R&D] ML 엔지니어 모집,엔씨소프트 2.7 성남 판교역,,개발 지원자격 학력 : 학사 이상 경력기간 : 3년 ~ 필수조건 - ML에 주로 사용되는 언어(R/ Python)에 능숙하신 분 - ML 도구(scikit-learn/Spark MLlib/Tensorflow/Pytorch 등...
https://kr.indeed.com/viewjob?jk=b5b88516a299bbb2,(주)신세계아이앤씨 경력사원 상시,신세계아이앤씨 서울 중구,,"0명 공통사항 -. 자동화 Tool에 대한 이해 보유자 -. JAVA, C, JavaScript, Python, HTML, JSP 등 프로그래밍 언어 개발 경험자... Process 및 Process Mangement에..."
https://kr.indeed.com/viewjob?jk=78f5465432356e17,Sr Systems Administrator I,Raytheon Intelligence & Space 대한민국,,"Experience with Linux/Unix scripting, C++, Java, Perl, Python, Sybase... SQL. - Experience with Linux/Unix tools, YUM..."
https://kr.indeed.com/viewjob?jk=e2af029a81ae7506,2021-2회 인지 및 사회성 연구단 선임연구원,기초과학연구원 대전,,"험자, large scale neural population activity data 분석(MATLAB or Python 등) ㅇ 인원: 1명 [직종/직급 설명] ㅇ (선임연구원) 초임계약 후 1회에 한하여 재계약이 가능하며..."
https://kr.indeed.com/viewjob?jk=f258bcb2c6f24dc9,[빅데이터분석] 데이터 사업 기획 및 운영 담당자,한국카카오은행 성남 분당구,,"또는 머신러닝 관련 내용을 이해할 수 있는 분 · 적극적이고 원만한 커뮤니케이션이 가능한 분 우대사항 · Python, Java, Scala 등 프로그래밍 언어 사용 경험이 있는 분 · 전산/수학/통계 또는 관련 분야 학사..."
https://kr.indeed.com/viewjob?jk=330617e8381fbee6,각 부문별 수시,KIS채권평가 대한민국,,"경제)학, 통계학, 금융공학/수학 전공자 우대 - 관련업무 경력자 우대 - 프로그램밍 가능자(MSOffice/ Python 등) 우대 (2) 모집부서: <대체투자본부> *포지션: 채용연계형 인턴 *담당업무: - 비시장성지분증..."
https://kr.indeed.com/viewjob?jk=089931931a0474d5,소형전지사업부/기술혁신센터,삼성SDI 3.9 충청남도 천안,,"천안 전공분야 - 컴퓨터/시스템 전자/전기 기계/산공 전문지식 - Java, C#, C++, Python - Oracle (PL/SQL) - Automod, VisualComponent - 통신프로그래밍 경험..."
https://kr.indeed.com/viewjob?jk=57dead75c6dee2c1,글로벌 소셜카지노 서비스 해외사업 담당자 (경력),네오위즈 대한민국,,있는 분 우대사항 - 소셜 카지노 장르를 비롯해 카지노 산업 전반 대한 높은 이해도를 갖춘 분 - R과 Python 등을 활용해 통계 분석을 할 수 있는 분 - 우수한 영어 활용 능력과 글로벌 비즈니스 관련 경험이 있는 분...
https://kr.indeed.com/viewjob?jk=14b591547a3b9df5,[전문연구요원] 상시 (전직),네이버랩스 경기도,,"Tool Engineer ㅇ Python/C/C++ 언어 개발 용이 ㅇ... Design, Debugging Skills ㅇ스크립트 언어 개발 경험 ( Python, Bash, etc.) ㅇ Embedded Platform과..."
https://kr.indeed.com/viewjob?jk=58aeb0762366a605,위촉연구원 (에너지통계연구팀),에너지경제연구원 울산,,"우대사항 : SAS, R, Python, STATA, SPSS 등 통계분석... 경력 : 신입/경력(연차무관) 나이 : 무관 우대사항 SAS, R, Python, STATA, SPSS 등 통계분석패키지를 이용하여 데이터 분석을 해..."
https://kr.indeed.com/viewjob?jk=f611a72cc9b1761e,Plat.B 추진단 AID팀 Machine Learning&AI 정규직,이투스교육 서울 강남구,,"구축 지원자격 ﻿일반적인 Back-end 시스템 설계 및 개발 ML/AI 시스템 아키텍쳐 설계 경험 Python, scala, R 등 ML 및 통계 관련 언어 사용 경험 머신러닝 프레임워크 경험자 (TensorFlow..."
https://kr.indeed.com/viewjob?jk=ddd1f037549e47a2,"솔루션 개발자, 품질인력 채용",한화그룹 4.2 서울,,"Python 및 기타 프로그래밍 언어 능숙자(C/C++/C#/Java/PHP) 윈도우 및 리눅스 운영체제 활용 능숙자 IP 네트워크, 운영체제, 데이터베이스 등 CS 기본 지식 서버사이드스크립트( Python/PHP..."
https://kr.indeed.com/viewjob?jk=ce3e13c2bc8da256,[취업연계교육]전액무료 IT교육받고 취업하자,휴먼교육센터 청주 흥덕구,,UI 개발자 데이터베이스 개발자 AI활용 소프트웨어 개발자 JAVA& Python개발자 접수방법 및 접수기간 접수기간 : 2021년 01월 20일까지... 게임>빅데이터·AI(인공지능)> Python|인터넷·IT·통신·모바일·게임...
https://kr.indeed.com/viewjob?jk=ab38178e6071aa0f,"Engr, Apps Dev 2",KLA-Tencor 대한민국,,"working effectively with different cultures. Matlab/ Python experience is a plus. We offer a competitive, family friendly..."
https://kr.indeed.com/viewjob?jk=7453bfdc26273cd9,Quantitative Researcher,자산운용: Quantitative Research 서울,"연봉 110,000,000원 - 140,000,000원","깊은 사고력, 창의력, 직업적 윤리의식, 끈기 있고 명석한 자가주도형 인재 프로그래밍 가능 (C++, Python 선호하나 필수는 아님) 글로벌 금융 시장에 대해 배우려는 강력한 의지 영어로 의사소통이 원활하신 분 (서면 및..."
https://kr.indeed.com/viewjob?jk=5c7ce2a8bacecf7d,(광주취업맛집1위)2021년도 국비 기술교육생,대한상공회의소 광주인력개발원 광주 광산구,,통신·모바일·게임>빅데이터·AI(인공지능)>데이터분석|인터넷·IT·통신·모바일·게임>빅데이터·AI(인공지능)> Python|인터넷·IT·통신·모바일·게임>빅데이터·AI(인공지능)>머신러닝|인터넷·IT·통신·모바일·게임>빅데이터...
https://kr.indeed.com/viewjob?jk=3259e28d21f56288,[전문연구요원] 빅데이터 엔지니어(신입/경력),웹젠 성남 분당구,,통합 과정 수료자 포함)로서 전문연구요원 신규편입/전직 대상인 분 - Python 또는 C# 프로그래밍 능력을 보유한 분 - Linux 환경에서 개발... 요원 신규편입/전직 대상인 분 - Python 또는 C# 프로그래밍 능력을...
https://kr.indeed.com/viewjob?jk=05aa5498d84c58e1,데이터 엔지니어(신입/경력),쏘카 대한민국,,"있는 분 • 데이터 분석팀 및 유관 부서와의 원활한 소통을 위한 기본적인 쿼리 작성 능력을 갖춘 분 • Python 또는 Java, Scala, C++, C# 등의 언어를 최소 1개 이상 능숙하게 사용할 수 있는 분 • 대용..."
https://kr.indeed.com/viewjob?jk=f10a132f53b6307d,Applied Data Scientist,dunnhumby 서울,,"relevant subject Programming skills (Hadoop, Spark, SQL, Python) Prototyping Statistical Modelling Analytical Techniques..."
https://kr.indeed.com/viewjob?jk=dd6837145722038a,2021년 한화시스템 방산부문 경력사원,한화시스템 성남 분당구,,통신·모바일·게임>소프트웨어·하드웨어>소프트웨어|인터넷·IT·통신·모바일·게임>응용프로그래머>C·C++|인터넷·IT·통신·모바일·게임>응용프로그래머> Python|전자·기계·기술·화학·연구개발>기계·금속·재료>기계설계
